[Port2]  :  USB Composite Device


Is Port User Connectable:         yes
Is Port Debug Capable:            no
Companion Port Number:            2
Companion Hub Symbolic Link Name: USB#VID_0BDA&PID_0411#6&2638567d&0&4#{f18a0e88-c30c-11d0-8815-00a0c906bed8}
Protocols Supported:
 USB 1.1:                         yes
 USB 2.0:                         yes
 USB 3.0:                         no

Device Power State:               PowerDeviceD3

       ---===>Device Information<===---
English product name: "Webcam"

ConnectionStatus:                  
Current Config Value:              0x01  -> Device Bus Speed: High (is not SuperSpeed or higher capable)
Device Address:                    0x30
Open Pipes:                           1

          ===>Device Descriptor<===
bLength:                           0x12
bDescriptorType:                   0x01
bcdUSB:                          0x0200
bDeviceClass:                      0xEF  -> This is a Multi-interface Function Code Device
bDeviceSubClass:                   0x02  -> This is the Common Class Sub Class
bDeviceProtocol:                   0x01  -> This is the Interface Association Descriptor protocol
bMaxPacketSize0:                   0x40 = (64) Bytes
idVendor:                        0x0603 = Novatek Microelectronics Corp.
idProduct:                       0x8612
bcdDevice:                       0x0010
iManufacturer:                     0x01
     English (United States)  "NOVATEK "
iProduct:                          0x02
     English (United States)  "Webcam"
iSerialNumber:                     0x03
String Descriptor for index 3 not available while device is in low power state.
bNumConfigurations:                0x01

          ---===>Open Pipes<===---

          ===>Endpoint Descriptor<===
bLength:                           0x07
bDescriptorType:                   0x05
bEndpointAddress:                  0x85  -> Direction: IN - EndpointID: 5
bmAttributes:                      0x03  -> Interrupt Transfer Type
wMaxPacketSize:                  0x0040 = 1 transactions per microframe, 0x40 max bytes
bInterval:                         0x01

       ---===>Full Configuration Descriptor<===---

          ===>Configuration Descriptor<===
bLength:                           0x09
bDescriptorType:                   0x02
wTotalLength:                    0x029C  -> Validated
bNumInterfaces:                    0x02
bConfigurationValue:               0x01
iConfiguration:                    0x00
bmAttributes:                      0xC0  -> Self Powered
MaxPower:                          0x32 = 100 mA

          ===>IAD Descriptor<===
bLength:                           0x08
bDescriptorType:                   0x0B
bFirstInterface:                   0x00
bInterfaceCount:                   0x02
bFunctionClass:                    0x0E  -> Video Interface Class
bFunctionSubClass:                 0x03  -> Video Interface Collection
bFunctionProtocol:                 0x00  -> PC_PROTOCOL_UNDEFINED protocol
iFunction:                         0x00

          ===>Interface Descriptor<===
bLength:                           0x09
bDescriptorType:                   0x04
bInterfaceNumber:                  0x00
bAlternateSetting:                 0x00
bNumEndpoints:                     0x01
bInterfaceClass:                   0x0E  -> Video Interface Class
bInterfaceSubClass:                0x01  -> Video Control Interface SubClass
bInterfaceProtocol:                0x00
iInterface:                        0x00

          ===>Class-Specific Video Control Interface Header Descriptor<===
bLength:                           0x0D
bDescriptorType:                   0x24
bDescriptorSubtype:                0x01
bcdVDC:                          0x0100
wTotalLength:                    0x0054  -> Validated
dwClockFreq:                 0x01C9C380 = (30000000) Hz
bInCollection:                     0x01
baInterfaceNr[1]:                  0x01
USB Video Class device: spec version 1.0

          ===>Video Control Input Terminal Descriptor<===
bLength:                           0x11
bDescriptorType:                   0x24
bDescriptorSubtype:                0x02
bTerminalID:                       0x01
wTerminalType:                   0x0201 = (ITT_CAMERA)
bAssocTerminal:                    0x00
iTerminal:                         0x00
===>Camera Input Terminal Data
wObjectiveFocalLengthMin:        0x0000
wObjectiveFocalLengthMax:        0x0000
wOcularFocalLength:              0x0000
bControlSize:                      0x02
bmControls : 0x0A 0x00 
     D00 = 0   no -  Scanning Mode
     D01 = 1  yes -  Auto-Exposure Mode
     D02 = 0   no -  Auto-Exposure Priority
     D03 = 1  yes -  Exposure Time (Absolute)
     D04 = 0   no -  Exposure Time (Relative)
     D05 = 0   no -  Focus (Absolute)
     D06 = 0   no -  Focus (Relative)
     D07 = 0   no -  Iris (Absolute)
     D08 = 0   no -  Iris (Relative)
     D09 = 0   no -  Zoom (Absolute)
     D10 = 0   no -  Zoom (Relative)
     D11 = 0   no -  PanTilt (Absolute)
     D12 = 0   no -  PanTilt (Relative)
     D13 = 0   no -  Roll (Absolute)
     D14 = 0   no -  Roll (Relative)
     D15 = 0   no -  Reserved

          ===>Video Control Output Terminal Descriptor<===
bLength:                           0x09
bDescriptorType:                   0x24
bDescriptorSubtype:                0x03
bTerminalID:                       0x02
wTerminalType:                   0x0101 = (TT_STREAMING)
bAssocTerminal:                    0x00
bSourceID:                         0x04
iTerminal:                         0x00

          ===>Video Control Selector Unit Descriptor<===
bLength:                           0x07
bDescriptorType:                   0x24
bDescriptorSubtype:                0x04
bUnitID:                           0x03
bNrInPins:                         0x01
===>List of Connected Unit and Terminal ID's
baSourceID[1]:                     0x01
iSelector:                         0x00

          ===>Video Control Processing Unit Descriptor<===
bLength:                           0x0B
bDescriptorType:                   0x24
bDescriptorSubtype:                0x05
bUnitID:                           0x04
bSourceID:                         0x03
wMaxMultiplier:                  0x0000
bControlSize:                      0x02
bmControls : 0x5F 0x17 
     D00 = 1  yes -  Brightness
     D01 = 1  yes -  Contrast
     D02 = 1  yes -  Hue
     D03 = 1  yes -  Saturation
     D04 = 1  yes -  Sharpness
     D05 = 0   no -  Gamma
     D06 = 1  yes -  White Balance Temperature
     D07 = 0   no -  White Balance Component
     D08 = 1  yes -  Backlight Compensation
     D09 = 1  yes -  Gain
     D10 = 1  yes -  Power Line Frequency
     D11 = 0   no -  Hue, Auto
     D12 = 1  yes -  White Balance Temperature, Auto
     D13 = 0   no -  White Balance Component, Auto
     D14 = 0   no -  Digital Multiplier
     D15 = 0   no -  Digital Multiplier Limit
iProcessing :                      0x00

          ===>Video Control Extension Unit Descriptor<===
bLength:                           0x1B
bDescriptorType:                   0x24
bDescriptorSubtype:                0x06
bUnitID:                           0x05
guidExtensionCode:                 {C987A729-59D3-4569-8467-FF0849FC19E8}
bNumControls:                      0x08
bNrInPins:                         0x01
===>List of Connected Units and Terminal ID's
baSourceID[1]:                     0x04
bControlSize:                      0x02
bmControls : 0xFF 0x00 
     D00 = 1  yes -  Vendor-Specific (Optional)
     D01 = 1  yes -  Vendor-Specific (Optional)
     D02 = 1  yes -  Vendor-Specific (Optional)
     D03 = 1  yes -  Vendor-Specific (Optional)
     D04 = 1  yes -  Vendor-Specific (Optional)
     D05 = 1  yes -  Vendor-Specific (Optional)
     D06 = 1  yes -  Vendor-Specific (Optional)
     D07 = 1  yes -  Vendor-Specific (Optional)
     D08 = 0   no -  Vendor-Specific (Optional)
     D09 = 0   no -  Vendor-Specific (Optional)
     D10 = 0   no -  Vendor-Specific (Optional)
     D11 = 0   no -  Vendor-Specific (Optional)
     D12 = 0   no -  Vendor-Specific (Optional)
     D13 = 0   no -  Vendor-Specific (Optional)
     D14 = 0   no -  Vendor-Specific (Optional)
     D15 = 0   no -  Vendor-Specific (Optional)
iExtension:                        0x00

          ===>Endpoint Descriptor<===
bLength:                           0x07
bDescriptorType:                   0x05
bEndpointAddress:                  0x85  -> Direction: IN - EndpointID: 5
bmAttributes:                      0x03  -> Interrupt Transfer Type
wMaxPacketSize:                  0x0040 = 1 transactions per microframe, 0x40 max bytes
bInterval:                         0x01

          ===>Class-specific VC Interrupt Endpoint Descriptor<===
bLength:                           0x05 
bDescriptorType:                   0x25
bDescriptorSubtype:                0x03
wMaxTransferSize:                0x0040 = (64) Bytes

          ===>Interface Descriptor<===
bLength:                           0x09
bDescriptorType:                   0x04
bInterfaceNumber:                  0x01
bAlternateSetting:                 0x00
bNumEndpoints:                     0x00
bInterfaceClass:                   0x0E  -> Video Interface Class
bInterfaceSubClass:                0x02  -> Video Streaming Interface SubClass
bInterfaceProtocol:                0x00
iInterface:                        0x00

          ===>Video Class-Specific VS Video Input Header Descriptor<===
bLength:                           0x0F
bDescriptorType:                   0x24
bDescriptorSubtype:                0x01
bNumFormats:                       0x02
wTotalLength:                    0x01E9  -> Validated
bEndpointAddress:                  0x81  -> Direction: IN - EndpointID: 1
bmInfo:                            0x00  -> Dynamic Format Change not Supported
bTerminalLink:                     0x02
bStillCaptureMethod:               0x00  -> No Still Capture
bTriggerSupport:                   0x00  -> No Hardware Triggering Support
bTriggerUsage:                     0x00
bControlSize:                      0x01
Video Payload Format 1             0x04 
     D00 = 0   no -  Key Frame Rate
     D01 = 0   no -  P Frame Rate
     D02 = 1  yes -  Compression Quality
     D03 = 0   no -  Compression Window Size
     D04 = 0   no -  Generate Key Frame
     D05 = 0   no -  Update Frame Segment
     D06 = 0   no -  Reserved
     D07 = 0   no -  Reserved
Video Payload Format 2             0x00 
     D00 = 0   no -  Key Frame Rate
     D01 = 0   no -  P Frame Rate
     D02 = 0   no -  Compression Quality
     D03 = 0   no -  Compression Window Size
     D04 = 0   no -  Generate Key Frame
     D05 = 0   no -  Update Frame Segment
     D06 = 0   no -  Reserved
     D07 = 0   no -  Reserved

          ===>Video Streaming MJPEG Format Type Descriptor<===
bLength:                           0x0B
bDescriptorType:                   0x24
bDescriptorSubtype:                0x06
bFormatIndex:                      0x01
bNumFrameDescriptors:              0x05
bmFlags:                           0x00  -> Sample Size is Not Fixed
bDefaultFrameIndex:                0x01
bAspectRatioX:                     0x00
bAspectRatioY:                     0x00
bmInterlaceFlags:                  0x00
     D00   = 0  non-Interlaced stream or variable
     D01   = 0  2 fields per frame
     D02   = 0  Field 1 not first
     D03   = 0  Reserved
     D4..5 = 0  Field patterns  -> Field 1 only
     D6..7 = 0  Display Mode  -> Bob only
bCopyProtect:                      0x01  -> Duplication Restricted

          ===>Video Streaming MJPEG Frame Type Descriptor<===
          --->This is the Default (optimum) Frame index
bLength:                           0x1E
bDescriptorType:                   0x24
bDescriptorSubtype:                0x07
bFrameIndex:                       0x01
bmCapabilities:                    0x02
wWidth:                          0x0780 = 1920
wHeight:                         0x0438 = 1080
dwMinBitRate:                0x10000000
dwMaxBitRate:                0x10000000
dwMaxVideoFrameBufferSize:   0x003F4800
dwDefaultFrameInterval:      0x00051615 = 33.333300 mSec (30.00 Hz)
bFrameIntervalType:                0x01
===>Additional Discrete Frame TypeData
dwFrameInterval[1]:          0x00051615 = 33.333300 mSec (30.00 Hz)

          ===>Video Streaming MJPEG Frame Type Descriptor<===
bLength:                           0x1E
bDescriptorType:                   0x24
bDescriptorSubtype:                0x07
bFrameIndex:                       0x02
bmCapabilities:                    0x02
wWidth:                          0x0500 = 1280
wHeight:                         0x02D0 = 720
dwMinBitRate:                0x10000000
dwMaxBitRate:                0x10000000
dwMaxVideoFrameBufferSize:   0x001C2000
dwDefaultFrameInterval:      0x00051615 = 33.333300 mSec (30.00 Hz)
bFrameIntervalType:                0x01
===>Additional Discrete Frame TypeData
dwFrameInterval[1]:          0x00051615 = 33.333300 mSec (30.00 Hz)

          ===>Video Streaming MJPEG Frame Type Descriptor<===
bLength:                           0x1E
bDescriptorType:                   0x24
bDescriptorSubtype:                0x07
bFrameIndex:                       0x03
bmCapabilities:                    0x02
wWidth:                          0x0350 = 848
wHeight:                         0x01E0 = 480
dwMinBitRate:                0x10000000
dwMaxBitRate:                0x10000000
dwMaxVideoFrameBufferSize:   0x000C6C00
dwDefaultFrameInterval:      0x00051615 = 33.333300 mSec (30.00 Hz)
bFrameIntervalType:                0x01
===>Additional Discrete Frame TypeData
dwFrameInterval[1]:          0x00051615 = 33.333300 mSec (30.00 Hz)

          ===>Video Streaming MJPEG Frame Type Descriptor<===
bLength:                           0x1E
bDescriptorType:                   0x24
bDescriptorSubtype:                0x07
bFrameIndex:                       0x04
bmCapabilities:                    0x02
wWidth:                          0x0280 = 640
wHeight:                         0x01E0 = 480
dwMinBitRate:                0x10000000
dwMaxBitRate:                0x10000000
dwMaxVideoFrameBufferSize:   0x00096000
dwDefaultFrameInterval:      0x00051615 = 33.333300 mSec (30.00 Hz)
bFrameIntervalType:                0x01
===>Additional Discrete Frame TypeData
dwFrameInterval[1]:          0x00051615 = 33.333300 mSec (30.00 Hz)

          ===>Video Streaming MJPEG Frame Type Descriptor<===
bLength:                           0x1E
bDescriptorType:                   0x24
bDescriptorSubtype:                0x07
bFrameIndex:                       0x05
bmCapabilities:                    0x02
wWidth:                          0x0140 = 320
wHeight:                         0x00F0 = 240
dwMinBitRate:                0x10000000
dwMaxBitRate:                0x10000000
dwMaxVideoFrameBufferSize:   0x00025800
dwDefaultFrameInterval:      0x00051615 = 33.333300 mSec (30.00 Hz)
bFrameIntervalType:                0x01
===>Additional Discrete Frame TypeData
dwFrameInterval[1]:          0x00051615 = 33.333300 mSec (30.00 Hz)

          ===>Color Matching Descriptor<===
bLength:                           0x06
bDescriptorType:                   0x24
bDescriptorSubtype:                0x0D
bColorPrimaries:                   0x00
bTransferCharacteristics:          0x00
bMatrixCoefficients:               0x00
*!*ERROR: bDescriptorSubtype did not exist in UVC 1.0

          ===>Descriptor Hex Dump<===
bLength:                           0x1C
bDescriptorType:                   0x24
1C 24 10 02 05 48 32 36 34 00 00 10 00 80 00 00 
AA 00 38 9B 71 18 01 00 00 00 01 01 
*!*ERROR: bDescriptorSubtype did not exist in UVC 1.0

          ===>Descriptor Hex Dump<===
bLength:                           0x1E
bDescriptorType:                   0x24
1E 24 11 01 02 80 07 38 04 00 00 00 10 00 00 00 
10 15 16 05 00 01 00 00 00 00 15 16 05 00 
*!*ERROR: bDescriptorSubtype did not exist in UVC 1.0

          ===>Descriptor Hex Dump<===
bLength:                           0x1E
bDescriptorType:                   0x24
1E 24 11 02 02 00 05 D0 02 00 00 00 10 00 00 00 
10 15 16 05 00 01 00 00 00 00 15 16 05 00 
*!*ERROR: bDescriptorSubtype did not exist in UVC 1.0

          ===>Descriptor Hex Dump<===
bLength:                           0x1E
bDescriptorType:                   0x24
1E 24 11 03 02 50 03 E0 01 00 00 00 10 00 00 00 
10 15 16 05 00 01 00 00 00 00 15 16 05 00 
*!*ERROR: bDescriptorSubtype did not exist in UVC 1.0

          ===>Descriptor Hex Dump<===
bLength:                           0x1E
bDescriptorType:                   0x24
1E 24 11 04 02 80 02 E0 01 00 00 00 10 00 00 00 
10 15 16 05 00 01 00 00 00 00 15 16 05 00 
*!*ERROR: bDescriptorSubtype did not exist in UVC 1.0

          ===>Descriptor Hex Dump<===
bLength:                           0x1E
bDescriptorType:                   0x24
1E 24 11 05 02 40 01 F0 00 00 00 00 10 00 00 00 
10 15 16 05 00 01 00 00 00 00 15 16 05 00 

          ===>Color Matching Descriptor<===
bLength:                           0x06
bDescriptorType:                   0x24
bDescriptorSubtype:                0x0D
bColorPrimaries:                   0x00
bTransferCharacteristics:          0x00
bMatrixCoefficients:               0x00

          ===>Video Streaming Uncompressed Format Type Descriptor<===
bLength:                           0x1B
bDescriptorType:                   0x24
bDescriptorSubtype:                0x04
bFormatIndex:                      0x03
bNumFrameDescriptors:              0x03
guidFormat:                        {32595559-0000-0010-8000-00AA00389B71} = YUY2 Format
bBitsPerPixel:                     0x10
bDefaultFrameIndex:                0x01
bAspectRatioX:                     0x00
bAspectRatioY:                     0x00
bmInterlaceFlags:                  0x00
     D0    = 0x00 Interlaced stream or variable: No
     D1    = 0x00 Fields per frame: 2 fields
     D2    = 0x00 Field 1 first: No
     D3    = 0x00 Reserved
     D4..5 = 0x00 Field patterns  -> Field 1 only
     D6..7 = 0x00 Display Mode  -> Bob only
bCopyProtect:                      0x00  -> Duplication Unrestricted

          ===>Video Streaming Uncompressed Frame Type Descriptor<===
          --->This is the Default (optimum) Frame index
bLength:                           0x1E
bDescriptorType:                   0x24
bDescriptorSubtype:                0x05
bFrameIndex:                       0x01
bmCapabilities:                    0x00
wWidth:                          0x0280 = 640
wHeight:                         0x0190 = 400
dwMinBitRate:                0x0BB80000
dwMaxBitRate:                0x0BB80000
dwMaxVideoFrameBufferSize:   0x000C8000
dwDefaultFrameInterval:      0x00051615 = 33.333300 mSec (30.00 Hz)
bFrameIntervalType:                0x01
===>Additional Discrete Frame Type Data
dwFrameInterval[1]:          0x00051615 = 33.333300 mSec (30.00 Hz)

          ===>Video Streaming Uncompressed Frame Type Descriptor<===
bLength:                           0x1E
bDescriptorType:                   0x24
bDescriptorSubtype:                0x05
bFrameIndex:                       0x02
bmCapabilities:                    0x00
wWidth:                          0x0280 = 640
wHeight:                         0x0258 = 600
dwMinBitRate:                0x0BB80000
dwMaxBitRate:                0x0BB80000
dwMaxVideoFrameBufferSize:   0x000C8000
dwDefaultFrameInterval:      0x00051615 = 33.333300 mSec (30.00 Hz)
bFrameIntervalType:                0x01
===>Additional Discrete Frame Type Data
dwFrameInterval[1]:          0x00051615 = 33.333300 mSec (30.00 Hz)

          ===>Video Streaming Uncompressed Frame Type Descriptor<===
bLength:                           0x1E
bDescriptorType:                   0x24
bDescriptorSubtype:                0x05
bFrameIndex:                       0x03
bmCapabilities:                    0x00
wWidth:                          0x0500 = 1280
wHeight:                         0x0320 = 800
dwMinBitRate:                0x17700000
dwMaxBitRate:                0x17700000
dwMaxVideoFrameBufferSize:   0x00320000
dwDefaultFrameInterval:      0x000A2C2A = 66.666600 mSec (15.00 Hz)
bFrameIntervalType:                0x01
===>Additional Discrete Frame Type Data
dwFrameInterval[1]:          0x000A2C2A = 66.666600 mSec (15.00 Hz)

          ===>Color Matching Descriptor<===
bLength:                           0x06
bDescriptorType:                   0x24
bDescriptorSubtype:                0x0D
bColorPrimaries:                   0x00
bTransferCharacteristics:          0x00
bMatrixCoefficients:               0x00

          ===>Interface Descriptor<===
bLength:                           0x09
bDescriptorType:                   0x04
bInterfaceNumber:                  0x01
bAlternateSetting:                 0x01
bNumEndpoints:                     0x01
bInterfaceClass:                   0x0E  -> Video Interface Class
bInterfaceSubClass:                0x02  -> Video Streaming Interface SubClass
bInterfaceProtocol:                0x00
iInterface:                        0x00

          ===>Endpoint Descriptor<===
bLength:                           0x07
bDescriptorType:                   0x05
bEndpointAddress:                  0x81  -> Direction: IN - EndpointID: 1
bmAttributes:                      0x05  -> Isochronous Transfer Type, Synchronization Type = Asynchronous, Usage Type = Data Endpoint
wMaxPacketSize:                  0x0200 = 1 transactions per microframe, 0x200 max bytes
bInterval:                         0x01

          ===>Interface Descriptor<===
bLength:                           0x09
bDescriptorType:                   0x04
bInterfaceNumber:                  0x01
bAlternateSetting:                 0x02
bNumEndpoints:                     0x01
bInterfaceClass:                   0x0E  -> Video Interface Class
bInterfaceSubClass:                0x02  -> Video Streaming Interface SubClass
bInterfaceProtocol:                0x00
iInterface:                        0x00

          ===>Endpoint Descriptor<===
bLength:                           0x07
bDescriptorType:                   0x05
bEndpointAddress:                  0x81  -> Direction: IN - EndpointID: 1
bmAttributes:                      0x05  -> Isochronous Transfer Type, Synchronization Type = Asynchronous, Usage Type = Data Endpoint
wMaxPacketSize:                  0x0400 = 1 transactions per microframe, 0x400 max bytes
bInterval:                         0x01

          ===>Interface Descriptor<===
bLength:                           0x09
bDescriptorType:                   0x04
bInterfaceNumber:                  0x01
bAlternateSetting:                 0x03
bNumEndpoints:                     0x01
bInterfaceClass:                   0x0E  -> Video Interface Class
bInterfaceSubClass:                0x02  -> Video Streaming Interface SubClass
bInterfaceProtocol:                0x00
iInterface:                        0x00

          ===>Endpoint Descriptor<===
bLength:                           0x07
bDescriptorType:                   0x05
bEndpointAddress:                  0x81  -> Direction: IN - EndpointID: 1
bmAttributes:                      0x05  -> Isochronous Transfer Type, Synchronization Type = Asynchronous, Usage Type = Data Endpoint
wMaxPacketSize:                  0x1400 = 3 transactions per microframe, 0x400 max bytes
bInterval:                         0x01

          ===>Additional Error Checking<===
PASS: number of uncompressed-frame frame descriptors (3) == number of frame descriptors (3) specified in uncompressed format descriptor(s)
PASS: number of MJPEG frame descriptors (5) == number of frame descriptors (5) specified in MJPEG format descriptor(s)
